{
  "$schema": "http://json-schema.org/draft-04/schema#",
  "title": "User Schema",
  "description": "A user",
  "type": "object",
  "properties": {
    "username": {
      "description": "A unique name belonging to a user. Typically used for login",
      "type": "string"
    },
    "id": {
      "description" : "A globally unique (UUID) identifier for the user",
      "type": "string"
    },
    "externalSystemId": {
      "description": "An ID that corresponds to an external authority",
      "type": "string"
    },
    "barcode": {
      "description": "The library barcode for this user",
      "type": "string"
    },
    "active": {
      "description": "A flag to determine if a user can log in, take out loans, etc.",
      "type": "boolean"
    },
    "type": {
      "description": "The class of user",
      "type": "string"
    },
    "patronGroup": {
      "description": "A UUID corresponding to the group the user belongs to",
      "type": "string"
    },
    "departments": {
      "description": "A UUIDs corresponding to the departments the user belongs to",
      "type": "array",
      "uniqueItems": true,
      "items": {
        "type": "string",
        "$ref": "../../raml-util/schemas/uuid.schema"
      }
    },
    "meta": {
      "description": "Deprecated",
      "type": "object"
    },
    "proxyFor": {
      "description" : "Deprecated",
      "type": "array",
      "items": {
        "type": "string"
      }
    },
    "personal": {
      "description": "Personal information about the user",
      "type": "object",
      "properties": {
        "lastName": {
          "description": "The user's surname",
          "type": "string"
        },
        "firstName": {
          "description": "The user's given name",
          "type": "string"
        },
        "middleName": {
          "description": "The user's middle name (if any)",
          "type": "string"
        },
        "preferredFirstName": {
          "description": "The user's preferred name",
          "type": "string"
        },
        "email": {
          "description": "The user's email address",
          "type": "string"
        },
        "phone": {
          "description": "The user's primary phone number",
          "type": "string"
        },
        "mobilePhone": {
          "description": "The user's mobile phone number",
          "type": "string"
        },
        "dateOfBirth": {
          "type": "string",
          "description": "The user's birth date",
          "format": "date-time"
        },
        "addresses": {
          "description": "Physical addresses associated with the user",
          "type": "array",
          "minItems": 0,
          "items": {
            "type": "object",
            "properties": {
              "id": {
                "description": "A unique id for this address",
                "type": "string"
              },
              "countryId": {
                "description": "The country code for this address",
                "type": "string"
              },
              "addressLine1": {
                "description": "Address, Line 1",
                "type": "string"
              },
              "addressLine2": {
                "description": "Address, Line 2",
                "type": "string"
              },
              "city": {
                "description": "City name",
                "type": "string"
              },
              "region": {
                "description": "Region",
                "type": "string"
              },
              "postalCode": {
                "description": "Postal Code",
                "type": "string"
              },
              "addressTypeId": {
                "description": "A UUID that corresponds with an address type object",
                "type": "string"
              },
              "primaryAddress": {
                "description": "Is this the user's primary address?",
                "type": "boolean"
              }
            },
            "additionalProperties": true
          }
        },
        "preferredContactTypeId": {
          "description": "(Deprecated) ID of user's preferred contact type like Email, Mail, or Text Message  (see ui-users contactTypes.js)",
          "type": "string"
        },
        "preferredContactTypeIds": {
          "description": "IDs of user's preferred contact types like Email, Mail, or Text Message (see ui-users contactTypes.js)",
          "type": "array",
          "items": {
            "type": "string"
          }
        },
        "pronouns": {
          "description": "The user's pronouns",
          "type": "string",
          "maxLength": 300
        },
        "profilePictureLink": {
          "description": "Link to the profile picture, or only the id of the /users/profile-picture entry",
          "type": "string",
          "format": "uri"
        }
      },
      "additionalProperties": true,
      "required": [
        "lastName"
      ]
    },
    "enrollmentDate": {
      "description": "The date in which the user joined the organization",
      "type": "string",
      "format": "date-time"
    },
    "expirationDate": {
      "description": "The date for when the user becomes inactive",
      "type": "string",
      "format": "date-time"
    },
    "preferredEmailCommunication": {
      "description": "Preferred email communication types",
      "type": "array",
      "items": {
        "type": "string",
        "enum": ["Support", "Programs", "Services"]
      },
      "maxItems": 3,
      "uniqueItems": true
    },
    "loanAnonymizationPreference": {
      "description": "Preference for anonymizing the user's closed loans; a missing value means libraryPolicy",
      "type": "string",
      "enum": ["libraryPolicy", "asEarlyAsPossible", "never"]
    },
    "createdDate": {
      "description": "Deprecated",
      "type": "string",
      "format": "date-time"
    },
    "updatedDate": {
      "description": "Deprecated",
      "type": "string",
      "format": "date-time"
    },
    "metadata": {
      "type": "object",
      "$ref": "../../raml-util/schemas/metadata.schema"
    },
    "tags": {
      "type": "object",
      "$ref": "../../raml-util/schemas/tags.schema"
    },
    "customFields" : {
      "description": "Object that contains custom field",
      "type": "object",
      "additionalProperties": true
    }
  },
  "additionalProperties": true
}
